{
  "$schema": "https://json-schema.org/draft/2020-12/schema",
  "$id": "https://phaseform.dev/schema/0.1.0/phaseform.schema.json",
  "title": "PHASEFORM scene",
  "description": "A PHASEFORM v0.1 scene document for Phaser 4. Structure only: behavior (draw order, defaults, id uniqueness, valid frames, asset resolution) is defined in docs/SPEC.md and must be enforced by the loader.",
  "type": "object",
  "required": ["format", "version", "key", "size", "objects"],
  "properties": {
    "format": {
      "const": "phaseform"
    },
    "version": {
      "type": "string",
      "pattern": "^(0|[1-9][0-9]*)\\.(0|[1-9][0-9]*)\\.(0|[1-9][0-9]*)(-[0-9A-Za-z.-]+)?(\\+[0-9A-Za-z.-]+)?$",
      "description": "Spec version the file was written against (semver)."
    },
    "key": {
      "type": "string",
      "minLength": 1,
      "description": "Scene key, matching the key used with Phaser's scene manager."
    },
    "size": {
      "type": "object",
      "required": ["width", "height"],
      "properties": {
        "width": { "type": "number", "exclusiveMinimum": 0 },
        "height": { "type": "number", "exclusiveMinimum": 0 }
      },
      "additionalProperties": true,
      "description": "Game size in pixels (the Phaser game config width and height). All scenes in a game should agree."
    },
    "background": {
      "type": "string",
      "description": "Background color as a CSS color string."
    },
    "objects": {
      "type": "array",
      "items": { "$ref": "#/$defs/object" },
      "description": "Ordered list of objects. At the scene root, draw order is depth, then list position."
    },
    "extensions": {
      "$ref": "#/$defs/extensions"
    }
  },
  "additionalProperties": true,

  "$defs": {
    "extensions": {
      "type": "object",
      "propertyNames": {
        "pattern": "^[a-z][a-z0-9-]*$"
      },
      "description": "Extension data keyed by lowercase extension name. Loaders must preserve extensions they do not understand."
    },

    "vec2": {
      "type": "object",
      "required": ["x", "y"],
      "properties": {
        "x": { "type": "number" },
        "y": { "type": "number" }
      },
      "additionalProperties": true
    },

    "color": {
      "type": "string",
      "pattern": "^#[0-9a-fA-F]{6}$",
      "description": "Color as #rrggbb. Converted to Phaser's numeric tint."
    },

    "tintMode": {
      "enum": ["multiply", "fill", "add", "screen", "overlay", "hard-light"],
      "description": "Maps to Phaser's TintModes. Default multiply."
    },

    "blendMode": {
      "enum": ["normal", "add", "multiply", "screen"],
      "description": "The blend modes WebGL renders natively. Default normal for image, sprite and text; a container has none by default (its children keep their own). Phaser silently treats unknown names as normal, so loaders must reject unknown values."
    },

    "object": {
      "type": "object",
      "required": ["id", "type"],
      "properties": {
        "id": {
          "type": "string",
          "minLength": 1,
          "description": "Unique within the scene. Uniqueness is not expressible in JSON Schema and must be checked by the loader."
        },
        "type": {
          "type": "string",
          "minLength": 1,
          "description": "Object type. Open registry: unknown types are valid and must be preserved."
        },
        "name": { "type": "string", "default": "" },
        "x": { "type": "number", "default": 0 },
        "y": { "type": "number", "default": 0 },
        "depth": {
          "type": "number",
          "default": 0,
          "description": "Draw order at the scene root. Ignored for children of a container, where list order decides."
        },
        "alpha": { "type": "number", "minimum": 0, "maximum": 1, "default": 1 },
        "visible": { "type": "boolean", "default": true },
        "active": { "type": "boolean", "default": true },
        "scrollFactor": {
          "$ref": "#/$defs/vec2",
          "description": "Default {1, 1}. On a container it affects the container only."
        },
        "data": {
          "type": "object",
          "additionalProperties": true,
          "description": "Free key/value data applied with the game object's data manager."
        },
        "scripts": {
          "type": "array",
          "items": { "type": "string", "minLength": 1 },
          "description": "Script modules to attach, relative to the project root. Each may export create and update hooks, see docs/SPEC.md (Scripts)."
        },
        "params": {
          "type": "object",
          "additionalProperties": true,
          "description": "Plain JSON handed to the attached scripts. Lets one script serve many objects."
        },
        "placeholder": { "$ref": "#/$defs/placeholder" },
        "extensions": { "$ref": "#/$defs/extensions" },
        "children": {
          "type": "array",
          "items": { "$ref": "#/$defs/object" },
          "description": "Child objects. Valid only for type container."
        },

        "origin": { "$ref": "#/$defs/vec2", "description": "Default {0.5, 0.5} for image and sprite, {0, 0} for text. Invalid on container." },
        "scale": { "$ref": "#/$defs/vec2", "description": "Default {1, 1}." },
        "rotation": { "type": "number", "default": 0, "description": "Radians. Phaser normalizes to between -pi and pi." },
        "flipX": { "type": "boolean", "default": false },
        "flipY": { "type": "boolean", "default": false },
        "tint": { "$ref": "#/$defs/color", "description": "Default #ffffff. Invalid on container." },
        "tintMode": { "$ref": "#/$defs/tintMode" },
        "blendMode": { "$ref": "#/$defs/blendMode" },
        "fill": { "$ref": "#/$defs/fill" },
        "stroke": { "$ref": "#/$defs/stroke" }
      },
      "additionalProperties": true,
      "allOf": [
        {
          "if": { "properties": { "type": { "const": "container" } }, "required": ["type"] },
          "then": {
            "not": {
              "anyOf": [
                { "required": ["origin"] },
                { "required": ["flipX"] },
                { "required": ["flipY"] },
                { "required": ["tint"] },
                { "required": ["tintMode"] },
                { "required": ["width"] },
                { "required": ["height"] }
              ]
            }
          },
          "else": { "not": { "required": ["children"] } }
        },
        {
          "if": { "properties": { "type": { "enum": ["image", "sprite"] } }, "required": ["type"] },
          "then": { "$ref": "#/$defs/visualImage" }
        },
        {
          "if": { "properties": { "type": { "enum": ["rectangle", "ellipse", "triangle", "line", "polygon", "star", "arc"] } }, "required": ["type"] },
          "then": { "$ref": "#/$defs/shape" }
        },
        { "if": { "properties": { "type": { "const": "rectangle" } }, "required": ["type"] }, "then": { "$ref": "#/$defs/rectangle" } },
        { "if": { "properties": { "type": { "const": "ellipse" } }, "required": ["type"] }, "then": { "$ref": "#/$defs/ellipse" } },
        { "if": { "properties": { "type": { "const": "triangle" } }, "required": ["type"] }, "then": { "$ref": "#/$defs/triangle" } },
        { "if": { "properties": { "type": { "const": "line" } }, "required": ["type"] }, "then": { "$ref": "#/$defs/line" } },
        { "if": { "properties": { "type": { "const": "polygon" } }, "required": ["type"] }, "then": { "$ref": "#/$defs/polygon" } },
        { "if": { "properties": { "type": { "const": "star" } }, "required": ["type"] }, "then": { "$ref": "#/$defs/star" } },
        { "if": { "properties": { "type": { "const": "arc" } }, "required": ["type"] }, "then": { "$ref": "#/$defs/arc" } },
        {
          "if": { "properties": { "type": { "const": "text" } }, "required": ["type"] },
          "then": {
            "allOf": [
              { "$ref": "#/$defs/text" },
              { "not": { "anyOf": [{ "required": ["flipX"] }, { "required": ["flipY"] }] } }
            ]
          }
        }
      ]
    },

    "fill": {
      "type": "object",
      "required": ["color"],
      "properties": {
        "color": { "$ref": "#/$defs/color" },
        "alpha": { "type": "number", "minimum": 0, "maximum": 1, "default": 1 }
      },
      "additionalProperties": true,
      "description": "Shape fill. Absent means not filled. Valid on shapes only, and not on line."
    },

    "stroke": {
      "type": "object",
      "required": ["color"],
      "properties": {
        "color": { "$ref": "#/$defs/color" },
        "width": { "type": "number", "minimum": 0, "default": 1, "description": "Stroke width in pixels. On a line this is the start width." },
        "endWidth": { "type": "number", "minimum": 0, "description": "Line only. End width of a tapered stroke (WebGL). Defaults to width." },
        "alpha": { "type": "number", "minimum": 0, "maximum": 1, "default": 1 }
      },
      "additionalProperties": true,
      "description": "Shape outline. Absent means not stroked. Valid on shapes only."
    },

    "shape": {
      "not": {
        "anyOf": [
          { "required": ["tint"] },
          { "required": ["tintMode"] },
          { "required": ["flipX"] },
          { "required": ["flipY"] },
          { "required": ["children"] }
        ]
      },
      "description": "Shapes have no tint or flip. They are filled and stroked through fill and stroke."
    },

    "rectangle": {
      "type": "object",
      "required": ["width", "height"],
      "properties": {
        "width": { "type": "number", "minimum": 0 },
        "height": { "type": "number", "minimum": 0 }
      }
    },

    "ellipse": {
      "type": "object",
      "required": ["width", "height"],
      "properties": {
        "width": { "type": "number", "minimum": 0 },
        "height": { "type": "number", "minimum": 0 },
        "smoothness": { "type": "integer", "minimum": 1, "default": 64, "description": "Number of segments used to draw the outline." }
      }
    },

    "triangle": {
      "type": "object",
      "required": ["points"],
      "properties": {
        "points": { "type": "array", "minItems": 3, "maxItems": 3, "items": { "$ref": "#/$defs/vec2" }, "description": "The three corners, in the shape's local space." }
      }
    },

    "line": {
      "type": "object",
      "required": ["points", "stroke"],
      "properties": {
        "points": { "type": "array", "minItems": 2, "maxItems": 2, "items": { "$ref": "#/$defs/vec2" }, "description": "Start and end, in the shape's local space." }
      },
      "not": { "required": ["fill"] },
      "description": "A line is only visible through its stroke, so stroke is required and fill is invalid."
    },

    "polygon": {
      "type": "object",
      "required": ["points"],
      "properties": {
        "points": { "type": "array", "minItems": 3, "items": { "$ref": "#/$defs/vec2" }, "description": "Vertices in the shape's local space." }
      }
    },

    "star": {
      "type": "object",
      "required": ["innerRadius", "outerRadius"],
      "properties": {
        "pointCount": { "type": "integer", "minimum": 2, "default": 5, "description": "Number of points. Phaser calls this property points." },
        "innerRadius": { "type": "number", "minimum": 0 },
        "outerRadius": { "type": "number", "minimum": 0 }
      }
    },

    "arc": {
      "type": "object",
      "required": ["radius"],
      "properties": {
        "radius": { "type": "number", "minimum": 0 },
        "startAngle": { "type": "number", "default": 0, "description": "Degrees, as Phaser takes them." },
        "endAngle": { "type": "number", "default": 360, "description": "Degrees, as Phaser takes them." },
        "anticlockwise": { "type": "boolean", "default": false },
        "iterations": { "type": "number", "exclusiveMinimum": 0, "default": 0.01, "description": "Smoothness of the rendered arc. Smaller is smoother." }
      }
    },

    "placeholder": {
      "type": "object",
      "description": "Editor-only reference visual for an object whose appearance comes from code. A conforming loader never draws it. width and height are required when the placeholder shows a visual, and are exposed to scripts as the object size. The box spans (0, 0) to (width, height) in the object's local space.",
      "properties": {
        "kind": { "enum": ["rect", "ellipse", "polygon", "image"] },
        "width": { "type": "number", "exclusiveMinimum": 0 },
        "height": { "type": "number", "exclusiveMinimum": 0 },
        "fill": { "$ref": "#/$defs/color" },
        "stroke": { "$ref": "#/$defs/color" },
        "strokeWidth": { "type": "number", "minimum": 0 },
        "alpha": { "type": "number", "minimum": 0, "maximum": 1 },
        "points": {
          "type": "array",
          "minItems": 3,
          "items": { "$ref": "#/$defs/vec2" },
          "description": "Polygon vertices in local space. Polygon only."
        },
        "path": {
          "type": "string",
          "minLength": 1,
          "description": "Reference image path relative to the project root. It is not an asset key and is never loaded by the game. Image only."
        }
      },
      "required": ["kind", "width", "height"],
      "allOf": [
        { "if": { "properties": { "kind": { "const": "polygon" } } }, "then": { "required": ["points"] }, "else": { "not": { "required": ["points"] } } },
        { "if": { "properties": { "kind": { "const": "image" } } }, "then": { "required": ["path"] }, "else": { "not": { "required": ["path"] } } }
      ],
      "additionalProperties": true
    },

    "visualImage": {
      "type": "object",
      "required": ["key"],
      "properties": {
        "key": {
          "type": "string",
          "minLength": 1,
          "description": "Texture key the scene expects to be loaded. PHASEFORM does not define how it is loaded."
        },
        "frame": {
          "oneOf": [
            { "type": "integer", "minimum": 0 },
            { "type": "string", "minLength": 1 }
          ],
          "description": "Frame index or name within the texture. Defaults to the texture's default frame. Phaser silently falls back to the default frame when it is missing, so loaders must validate it."
        }
      },
      "additionalProperties": true
    },

    "text": {
      "type": "object",
      "required": ["text"],
      "properties": {
        "text": { "type": "string" },
        "style": {
          "type": "object",
          "description": "Phaser text style config, passed through unchanged (nested shadow and wordWrap objects, padding inside). Phaser defaults: Courier, 16px, white. metrics, if present, must be preserved because it changes text height.",
          "additionalProperties": true
        }
      },
      "additionalProperties": true
    }
  }
}
