{
  "format": "phaseform",
  "version": "0.1.0",
  "key": "CoreFields",
  "size": { "width": 800, "height": 600 },
  "objects": [
    {
      "id": "glow",
      "type": "image",
      "name": "glow-effect",
      "key": "spark",
      "x": 400,
      "y": 300,
      "blendMode": "add",
      "tint": "#66ccff",
      "tintMode": "multiply",
      "flipX": true,
      "rotation": 0.785,
      "data": { "damage": 5 }
    },
    {
      "id": "sky",
      "type": "image",
      "key": "sky",
      "origin": { "x": 0, "y": 0 },
      "scrollFactor": { "x": 0.2, "y": 0.2 },
      "depth": -10
    },
    {
      "id": "hud",
      "type": "container",
      "depth": 100,
      "scrollFactor": { "x": 0, "y": 0 },
      "active": true,
      "children": [
        { "id": "label", "type": "text", "text": "Level 1", "x": 16, "y": 16, "style": { "fontSize": 24 } },
        { "id": "icon", "type": "image", "key": "heart", "x": 16, "y": 56 }
      ]
    },
    { "id": "debug-draw", "type": "graphics", "x": 0, "y": 0, "futureField": { "preserved": true } }
  ]
}
